{
  "schema_version": "0.1.0",
  "blocker_id": "blocker.001",
  "version": 1,
  "mission_id": "mission.001",
  "scope_type": "stage",
  "scope_id": "stage.001",
  "class": "evidence",
  "reason_code": "fixture.evidence.missing",
  "opened_by_event": "event.001",
  "evidence_refs": [],
  "resolution_requirement": "Record the missing immutable evidence artifact",
  "status": "open",
  "resolved_by_event": null
}
